Name,Role,Research,Hobbies,Website,Github,Email,Picture
Federico Iuricich,ASSISTANT PROFESSOR,"Visualization, Topological Data Analysis, Geometry processing, Spatial data structures, Unstructured data.","Rock Climbing, Mountain biking, Hiking, Cooking.",https://fiurici.people.clemson.edu/,https://github.com/IuricichF,fiurici@clemson.edu,img/people/iuricich.jpeg
Guoxi Liu,PH.D. STUDENT,"Scientific Visualization, Topological Data Analysis, Spatial Data Structures","Traveling, Hiking, Reading",https://guoxil.people.clemson.edu/,https://github.com/guoxiliu,guoxil@clemson.edu,img/people/guoxil.jpg
Xueyi Bao,PH.D. STUDENT,"Scientific Visualization, Rendering, Computational Geometry","Jogging, Badminton, Movies",,https://github.com/4321baoxueyi,xueyib@clemson.edu,img/people/xueyi.jpg.png
Fardifa Fathmiul Alam ,PH.D. Student,"Data Visualisation, Spatial Data Structures in Autonomous Navigation, Image Processing","Photography, Travelling, Cooking",,www.github.com/fardifa,fardifa@g.clemson.edu,img/people/fardifa.jpg
Mahsa Partovi,PH.D. Student,"Deep learning, Data analysis, Geographical information systems(GIS), Spatial data analysis","cooking, reading",,https://github.com/mahsapartovi,mpartov@clemson.edu,img/people/mahsa.jpg
Grace Austen,Research associate,"Data Analysis, Visualization, Machine Learning","Reading, Hiking",,https://github.com/Grace-Austen,gausten@clemson.edu,img/people/Grace.JPG
Akhila Nangineedi,Master Student,"Data Analysis, Machine Learning, Deep Learning","Reading, Music, Watching Documentaries",,https://github.com/sumanthnangineedi97,anangin@clemson.edu,img/people/akhila.jpeg
James Schvaneveldt,UG student,"Data visualization, Image processing, Data analysis","Reading, Piano, Music",,,jschvan@clemson.edu,img/people/james.jpg